accession	reference_length	covered_bases	reads_aligned	mean_coverage	RPKMF	sequence_name	taxid	kingdom	phylum	class	order	family	genus	species	subspecies	strain	sample_ID	total_filtered_reads_in_sample
NC_011507.2	18562	2073	871	20.070715	0.952089	Rotavirus A, all segments	28875	Viruses	Duplornaviricota	Resentoviricetes	Reovirales	Sedoreoviridae	Rotavirus	Rotavirus A	unclassified Rotavirus A subspecies/strain	unclassified Rotavirus A strain	XS22XX.p1839	49285120
NC_039477.1	7567	6435	6797	120.44506	18.2254	Norovirus GII, complete genome	122929	Viruses	Pisuviricota	Pisoniviricetes	Picornavirales	Caliciviridae	Norovirus	Norwalk virus	Norovirus GII	Norovirus GII	XS22XX.p1839	49285120
NC_039475.1	7556	3405	831	14.445584	2.23148	Norovirus GII.17, complete genome	552592	Viruses	Pisuviricota	Pisoniviricetes	Picornavirales	Caliciviridae	Norovirus	Norwalk virus	Norovirus GII.17	Norovirus GII.17	XS22XX.p1839	49285120
NC_039476.1	7536	5786	2513	43.233955	6.76606	Norovirus GII.2 strain Env/CHN/2016/GII.P16-GII.2/BJSMQ, complete genome	490039	Viruses	Pisuviricota	Pisoniviricetes	Picornavirales	Caliciviridae	Norovirus	Norwalk virus	Norovirus GII.2	Norovirus GII.2	XS22XX.p1839	49285120
KX868289.2	33676	9541	1341	5.1357155	0.807965	Human adenovirus 12 isolate GyK010, complete genome	28282	Viruses	Preplasmiviricota	Tectiliviricetes	Rowavirales	Adenoviridae	Mastadenovirus	Human mastadenovirus A	Human adenovirus 12	Human adenovirus 12	XS22XX.p1839	49285120
AM749299.1	33763	22511	6330	24.18814	3.80406	Human adenovirus type 31 complete genome, serotype 31	10529	Viruses	Preplasmiviricota	Tectiliviricetes	Rowavirales	Adenoviridae	Mastadenovirus	Human mastadenovirus A	Human adenovirus 31	Human adenovirus 31	XS22XX.p1839	49285120
AC_000017.1	36001	3382	661	2.3967812	0.372538	Human adenovirus type 1, complete genome	10533	Viruses	Preplasmiviricota	Tectiliviricetes	Rowavirales	Adenoviridae	Mastadenovirus	Human mastadenovirus C	Human adenovirus 1	Human adenovirus 1	XS22XX.p1839	49285120
JQ326209.1	35153	3959	1743	6.216867	1.00605	Human adenovirus 19, complete genome	28278	Viruses	Preplasmiviricota	Tectiliviricetes	Rowavirales	Adenoviridae	Mastadenovirus	Human mastadenovirus D	Human adenovirus 19	Human adenovirus 19	XS22XX.p1839	49285120
NC_012564.1	5242	1123	269	5.966418	1.04121	Human bocavirus 3, complete genome	638313	Viruses	Cossaviricota	Quintoviricetes	Piccovirales	Parvoviridae	Bocaparvovirus	Primate bocaparvovirus 1	Human bocavirus 3	Human bocavirus 3	XS22XX.p1839	49285120
NC_012042.1	5196	1743	327	7.2998414	1.27692	Human bocavirus 2c PK isolate PK-5510, complete genome	1511882	Viruses	Cossaviricota	Quintoviricetes	Piccovirales	Parvoviridae	Bocaparvovirus	Primate bocaparvovirus 2	Human bocavirus 2c PK	Human bocavirus 2c PK	XS22XX.p1839	49285120
NC_045512.2	29903	1439	177	0.7752159	0.1201	Severe acute respiratory syndrome coronavirus 2 isolate Wuhan-Hu-1, complete genome	2697049	Viruses	Pisuviricota	Pisoniviricetes	Nidovirales	Coronaviridae	Betacoronavirus	Severe acute respiratory syndrome-related coronavirus	Severe acute respiratory syndrome coronavirus 2	Severe acute respiratory syndrome coronavirus 2	XS22XX.p1839	49285120
KY316160.1	34169	33684	25607	96.148094	15.2058	Human adenovirus 41 isolate SH/2015/D16, complete genome	10524	Viruses	Preplasmiviricota	Tectiliviricetes	Rowavirales	Adenoviridae	Mastadenovirus	Human mastadenovirus F	Human adenovirus 41	Human adenovirus 41	XS22XX.p1839	49285120
AB008673.1	613	592	977	241.41252	32.3384	Human rotavirus C mRNA for NSP4, complete cds	10943	Viruses	Duplornaviricota	Resentoviricetes	Reovirales	Sedoreoviridae	Rotavirus	Rotavirus C	Human rotavirus C	Human rotavirus C	XS22XX.p1839	49285120
AB010145.1	8251	2174	225	2.901864	0.553299	Aichi virus genomic RNA, complete genome	1313215	Viruses	Pisuviricota	Pisoniviricetes	Picornavirales	Picornaviridae	Kobuvirus	Aichivirus A	Aichi virus 1	Aichi virus 1	XS22XX.p1839	49285120
AB186897.1	2525	1318	218	11.465263	1.75178	Human picobirnavirus RNA segment 1 genomic RNA, complete sequence	145856	Viruses	Pisuviricota	Duplopiviricetes	Durnavirales	Picobirnaviridae	Orthopicobirnavirus	Orthopicobirnavirus hominis	Human picobirnavirus	Human picobirnavirus	XS22XX.p1839	49285120
AB308374.1	6673	5750	4965	96.05304	15.0967	Mamastrovirus 1 genomic RNA, complete genome, isolate: V1347	1239565	Viruses	Pisuviricota	Stelpaviricetes	Stellavirales	Astroviridae	Mamastrovirus	Mamastrovirus 1	unclassified Mamastrovirus 1 subspecies/strain	unclassified Mamastrovirus 1 strain	XS22XX.p1839	49285120
AB623037.2	7442	5380	1217	21.099424	3.31807	Sapovirus Hu/OH08021/2008/JP genomic RNA, complete genome	1003429	Viruses	Pisuviricota	Pisoniviricetes	Picornavirales	Caliciviridae	Sapovirus	Sapporo virus	Sapovirus Hu/OH08021/2008/JP	Sapovirus Hu/OH08021/2008/JP	XS22XX.p1839	49285120
AF043303.1	4679	4645	9114	260.85757	39.5221	Adeno-associated virus 2, complete genome	10804	Viruses	Cossaviricota	Quintoviricetes	Piccovirales	Parvoviridae	Dependoparvovirus	Adeno-associated dependoparvovirus A	adeno-associated virus 2	adeno-associated virus 2	XS22XX.p1839	49285120
AF192260.1	5454	2080	233	5.2236047	0.866812	Periplaneta fuliginosa densovirus, complete genome	97344	Viruses	Cossaviricota	Quintoviricetes	Piccovirales	Parvoviridae	Pefuambidensovirus	Blattodean pefuambidensovirus 1	Periplaneta fuliginosa densovirus	Periplaneta fuliginosa densovirus	XS22XX.p1839	49285120
AF260508.1	6759	5744	8810	170.66985	26.4471	Human astrovirus type 8, complete genome	43358	Viruses	Pisuviricota	Stelpaviricetes	Stellavirales	Astroviridae	Mamastrovirus	Mamastrovirus 1	Human astrovirus 8	Human astrovirus 8	XS22XX.p1839	49285120
AF332135.1	1196	949	520	60.9283	8.82178	Orthoreovirus 3 Dearing-derived E64-adapted 1 (D-EA1) sigma 3 gene, complete cds	10886	Viruses	Duplornaviricota	Resentoviricetes	Reovirales	Spinareoviridae	Orthoreovirus	Mammalian orthoreovirus	Mammalian orthoreovirus 3 Dearing	Mammalian orthoreovirus 3 Dearing	XS22XX.p1839	49285120
AF473561.1	5666	1244	462	10.37074	1.65443	Beet western yellows virus strain USA, complete genome	12042	Viruses	Pisuviricota	Pisoniviricetes	Sobelivirales	Solemoviridae	Polerovirus	Beet western yellows virus	unclassified Beet western yellows virus subspecies/strain	unclassified Beet western yellows virus strain	XS22XX.p1839	49285120
AJ249939.1	7490	1234	64	1.0964577	0.173373	Human calicivirus SLV/Bristol/98/UK gene for polyprotein and ORF2, genomic RNA	248942	Viruses	Pisuviricota	Pisoniviricetes	Picornavirales	Caliciviridae	Sapovirus	Sapporo virus	Sapovirus Hu/Bristol/1998/UK	Sapovirus Hu/Bristol/1998/UK	XS22XX.p1839	49285120
AY646856.2	7500	1590	186	3.28	0.503194	Sapovirus NongKhai-24/Thailand, complete genome	300717	Viruses	Pisuviricota	Pisoniviricetes	Picornavirales	Caliciviridae	Sapovirus	Sapporo virus	Sapovirus NongKhai-24/Thailand	Sapovirus NongKhai-24/Thailand	XS22XX.p1839	49285120
AY720891.1	6723	4692	3574	64.45231	10.7864	Human astrovirus type 4 strain Dresden, complete genome	35300	Viruses	Pisuviricota	Stelpaviricetes	Stellavirales	Astroviridae	Mamastrovirus	Mamastrovirus 1	Human astrovirus 4	Human astrovirus 4	XS22XX.p1839	49285120
D14723.1	2363	2320	2511	147.65161	21.5609	Rotavirus sp. FRV64 mRNA for VP4 (VP8 and VP5 region) complete cds	39010	Viruses	Duplornaviricota	Resentoviricetes	Reovirales	Sedoreoviridae	Rotavirus	Feline rotavirus	Feline rotavirus frv-64	Feline rotavirus frv-64	XS22XX.p1839	49285120
DQ125333.1	7437	2348	318	5.5389047	0.867588	Sapovirus Hu/Angelholm/SW278/2004/SE polyprotein mRNA, complete cds; and unknown genes	343513	Viruses	Pisuviricota	Pisoniviricetes	Picornavirales	Caliciviridae	Sapovirus	Sapporo virus	Sapovirus Hu/Angelholm/SW278/2004/SE	Sapovirus Hu/Angelholm/SW278/2004/SE	XS22XX.p1839	49285120
DQ811788.1	28571	2849	726	3.334084	0.515579	TGEV Purdue P115, complete genome	398811	Viruses	Pisuviricota	Pisoniviricetes	Nidovirales	Coronaviridae	Alphacoronavirus	Alphacoronavirus 1	TGEV Purdue P115	TGEV Purdue P115	XS22XX.p1839	49285120
EF059918.1	750	722	15737	3035.3232	425.74	Human rotavirus G12 strain CAU 195 NSP4 gene, complete cds	215680	Viruses	Duplornaviricota	Resentoviricetes	Reovirales	Sedoreoviridae	Rotavirus	Rotavirus A	Rotavirus G12	Rotavirus G12	XS22XX.p1839	49285120
EF059923.1	2359	2359	79265	4684.7817	681.77	Human rotavirus G9 strain CAU 202 VP4 gene, complete cds	42567	Viruses	Duplornaviricota	Resentoviricetes	Reovirales	Sedoreoviridae	Rotavirus	Rotavirus A	Rotavirus G9	Rotavirus G9	XS22XX.p1839	49285120
EU708890.1	3269	3257	5880	247.79738	36.4961	Human rotavirus Ro1845 VP1 protein (VP1) gene, complete cds	557245	Viruses	Duplornaviricota	Resentoviricetes	Reovirales	Sedoreoviridae	Rotavirus	Rotavirus A	Human rotavirus Ro1845	Human rotavirus Ro1845	XS22XX.p1839	49285120
EU708891.1	2653	2591	2729	138.48622	20.8713	Human rotavirus Ro1845 VP2 protein (VP2) gene, complete cds	557245	Viruses	Duplornaviricota	Resentoviricetes	Reovirales	Sedoreoviridae	Rotavirus	Rotavirus A	Human rotavirus Ro1845	Human rotavirus Ro1845	XS22XX.p1839	49285120
EU708895.1	1007	989	652	89.434074	13.1372	Human rotavirus Ro1845 VP7 protein (VP7) gene, complete cds	557245	Viruses	Duplornaviricota	Resentoviricetes	Reovirales	Sedoreoviridae	Rotavirus	Rotavirus A	Human rotavirus Ro1845	Human rotavirus Ro1845	XS22XX.p1839	49285120
EU708896.1	1546	1516	1486	135.87894	19.5026	Human rotavirus Ro1845 NSP1 protein (NSP1) gene, complete cds	557245	Viruses	Duplornaviricota	Resentoviricetes	Reovirales	Sedoreoviridae	Rotavirus	Rotavirus A	Human rotavirus Ro1845	Human rotavirus Ro1845	XS22XX.p1839	49285120
EU708897.1	1022	926	548	61.048164	10.8796	Human rotavirus Ro1845 NSP2 protein (NSP2) gene, complete cds	557245	Viruses	Duplornaviricota	Resentoviricetes	Reovirales	Sedoreoviridae	Rotavirus	Rotavirus A	Human rotavirus Ro1845	Human rotavirus Ro1845	XS22XX.p1839	49285120
EU708898.1	1025	992	1814	266.5177	35.9085	Human rotavirus Ro1845 NSP3 protein (NSP3) gene, complete cds	557245	Viruses	Duplornaviricota	Resentoviricetes	Reovirales	Sedoreoviridae	Rotavirus	Rotavirus A	Human rotavirus Ro1845	Human rotavirus Ro1845	XS22XX.p1839	49285120
EU708899.1	704	703	2338	450.04333	67.3839	Human rotavirus Ro1845 NSP4 protein (NSP4) gene, complete cds	557245	Viruses	Duplornaviricota	Resentoviricetes	Reovirales	Sedoreoviridae	Rotavirus	Rotavirus A	Human rotavirus Ro1845	Human rotavirus Ro1845	XS22XX.p1839	49285120
EU708900.1	631	448	799	195.23077	25.6922	Human rotavirus Ro1845 NSP5 protein (NSP5) gene, complete cds	557245	Viruses	Duplornaviricota	Resentoviricetes	Reovirales	Sedoreoviridae	Rotavirus	Rotavirus A	Human rotavirus Ro1845	Human rotavirus Ro1845	XS22XX.p1839	49285120
FJ222451.1	6171	4688	1097	23.562696	3.60691	Astrovirus MLB1, complete genome	568715	Viruses	Pisuviricota	Stelpaviricetes	Stellavirales	Astroviridae	Mamastrovirus	Astrovirus MLB1	unclassified Astrovirus MLB1 subspecies/strain	unclassified Astrovirus MLB1 strain	XS22XX.p1839	49285120
FJ755404.1	6771	4051	1447	25.307356	4.33611	Human astrovirus 1 Beijing/291/2007/CHN, complete genome	626180	Viruses	Pisuviricota	Stelpaviricetes	Stellavirales	Astroviridae	Mamastrovirus	Mamastrovirus 1	Human astrovirus 1 Beijing/291/2007/CHN	Human astrovirus 1 Beijing/291/2007/CHN	XS22XX.p1839	49285120
FJ755405.1	6771	4304	2173	42.272617	6.51165	Human astrovirus 1 Beijing/293/2007/CHN, complete genome	626181	Viruses	Pisuviricota	Stelpaviricetes	Stellavirales	Astroviridae	Mamastrovirus	Mamastrovirus 1	Human astrovirus 1 Beijing/293/2007/CHN	Human astrovirus 1 Beijing/293/2007/CHN	XS22XX.p1839	49285120
FJ973620.1	6586	6524	4086	79.8339	12.5881	Astrovirus VA1, complete genome	645687	Viruses	Pisuviricota	Stelpaviricetes	Stellavirales	Astroviridae	Mamastrovirus	Mamastrovirus 9	Astrovirus VA1	Astrovirus VA1	XS22XX.p1839	49285120
GQ225794.1	1194	1132	4818	541.8506	81.8741	Rotavirus A AU32xUK reassortant (UKg9AU32) VP6 protein gene, complete cds	666966	Viruses	Duplornaviricota	Resentoviricetes	Reovirales	Sedoreoviridae	Rotavirus	Rotavirus A	Rotavirus A AU32xUK reassortant (UKg9AU32)	Rotavirus A AU32xUK reassortant (UKg9AU32)	XS22XX.p1839	49285120
GQ415660.1	6534	4232	798	16.262218	2.47804	Mamastrovirus 8 isolate NI-295, complete genome	1239572	Viruses	Pisuviricota	Stelpaviricetes	Stellavirales	Astroviridae	Mamastrovirus	Mamastrovirus 8	unclassified Mamastrovirus 8 subspecies/strain	unclassified Mamastrovirus 8 strain	XS22XX.p1839	49285120
GU589577.1	3860	1885	257	8.369272	1.35092	Mammalian orthoreovirus 3 strain Abney segment L1, complete sequence	538123	Viruses	Duplornaviricota	Resentoviricetes	Reovirales	Spinareoviridae	Orthoreovirus	Mammalian orthoreovirus	Mammalian orthoreovirus 3	Mammalian orthoreovirus 3	XS22XX.p1839	49285120
GU589580.1	2304	1275	561	31.012535	4.94043	Mammalian orthoreovirus 3 strain Abney segment M1, complete sequence	538123	Viruses	Duplornaviricota	Resentoviricetes	Reovirales	Spinareoviridae	Orthoreovirus	Mammalian orthoreovirus	Mammalian orthoreovirus 3	Mammalian orthoreovirus 3	XS22XX.p1839	49285120
GU589581.1	2207	1632	552	33.84735	5.07482	Mammalian orthoreovirus 3 strain Abney segment M2, complete sequence	538123	Viruses	Duplornaviricota	Resentoviricetes	Reovirales	Spinareoviridae	Orthoreovirus	Mammalian orthoreovirus	Mammalian orthoreovirus 3	Mammalian orthoreovirus 3	XS22XX.p1839	49285120
GU589584.1	1331	1167	811	84.452156	12.3631	Mammalian orthoreovirus 3 strain Abney segment S2, complete sequence	538123	Viruses	Duplornaviricota	Resentoviricetes	Reovirales	Spinareoviridae	Orthoreovirus	Mammalian orthoreovirus	Mammalian orthoreovirus 3	Mammalian orthoreovirus 3	XS22XX.p1839	49285120
GU937877.1	3302	3302	73432	2998.7222	451.224	Caprine rotavirus A strain GO34 RNA-dependent RNA polymerase (VP1) gene, complete cds	204932	Viruses	Duplornaviricota	Resentoviricetes	Reovirales	Sedoreoviridae	Rotavirus	Rotavirus A	Caprine rotavirus A	Caprine rotavirus A	XS22XX.p1839	49285120
GU937881.1	1356	1334	39429	4322.8145	589.984	Caprine rotavirus A strain GO34 VP6 protein (VP6) gene, complete cds	204932	Viruses	Duplornaviricota	Resentoviricetes	Reovirales	Sedoreoviridae	Rotavirus	Rotavirus A	Caprine rotavirus A	Caprine rotavirus A	XS22XX.p1839	49285120
GU984757.1	1356	1210	3299	298.38806	49.3636	Bovine rotavirus A strain 68 VP6 (VP6) gene, complete cds	35333	Viruses	Duplornaviricota	Resentoviricetes	Reovirales	Sedoreoviridae	Rotavirus	Rotavirus A	Bovine rotavirus A	Bovine rotavirus A	XS22XX.p1839	49285120
HM011556.1	5387	1298	218	5.2148175	0.821096	Merkel cell polyomavirus isolate R17b, complete genome	493803	Viruses	Cossaviricota	Papovaviricetes	Sepolyvirales	Polyomaviridae	Alphapolyomavirus	Alphapolyomavirus quintihominis	Merkel cell polyomavirus	Merkel cell polyomavirus	XS22XX.p1839	49285120
J02226.1	5130	4437	2653	69.13173	10.4931	JC virus complete genome	10632	Viruses	Cossaviricota	Papovaviricetes	Sepolyvirales	Polyomaviridae	Betapolyomavirus	Betapolyomavirus secuhominis	JC polyomavirus	JC polyomavirus	XS22XX.p1839	49285120
J02400.1	5243	4860	2425	61.370117	9.38461	Simian virus 40 complete genome	1891767	Viruses	Cossaviricota	Papovaviricetes	Sepolyvirales	Polyomaviridae	Betapolyomavirus	Betapolyomavirus macacae	unclassified Betapolyomavirus macacae subspecies/strain	unclassified Betapolyomavirus macacae strain	XS22XX.p1839	49285120
JF742759.1	6119	1885	234	4.7572455	0.775925	Astrovirus MLB2 isolate MLB2/human/Stl/WD0559/2008, complete genome	683172	Viruses	Pisuviricota	Stelpaviricetes	Stellavirales	Astroviridae	unclassified Astroviridae genus	Astrovirus MLB2	unclassified Astrovirus MLB2 subspecies/strain	unclassified Astrovirus MLB2 strain	XS22XX.p1839	49285120
JF831955.1	672	576	1714	351.93103	51.7518	Rotavirus A Ind/HR/B91 NSP4 gene, complete cds	1169011	Viruses	Duplornaviricota	Resentoviricetes	Reovirales	Sedoreoviridae	Rotavirus	Rotavirus A	Rotavirus A Ind/HR/B91	Rotavirus A Ind/HR/B91	XS22XX.p1839	49285120
JN088541.1	8289	1862	462	8.023713	1.1309	Canine kobuvirus US-PC0082, complete genome	1082189	Viruses	Pisuviricota	Pisoniviricetes	Picornavirales	Picornaviridae	Kobuvirus	Aichivirus A	Canine kobuvirus US-PC0082	Canine kobuvirus US-PC0082	XS22XX.p1839	49285120
JN648103.1	5413	4186	992	24.450884	3.71841	Canine bocavirus 1 isolate Con-161, complete genome	1511885	Viruses	Cossaviricota	Quintoviricetes	Piccovirales	Parvoviridae	Bocaparvovirus	Carnivore bocaparvovirus 2	Canine bocavirus 1	Canine bocavirus 1	XS22XX.p1839	49285120
JN799423.1	2306	2044	732	44.75232	6.44074	Mammalian orthoreovirus strain 729 segment M1 mu-2 gene, complete cds	351073	Viruses	Duplornaviricota	Resentoviricetes	Reovirales	Spinareoviridae	Orthoreovirus	Mammalian orthoreovirus	unclassified Mammalian orthoreovirus subspecies/strain	unclassified Mammalian orthoreovirus strain	XS22XX.p1839	49285120
JN799425.1	2243	1809	482	29.604395	4.36016	Mammalian orthoreovirus strain 729 segment M3 mu-NS gene, complete cds	351073	Viruses	Duplornaviricota	Resentoviricetes	Reovirales	Spinareoviridae	Orthoreovirus	Mammalian orthoreovirus	unclassified Mammalian orthoreovirus subspecies/strain	unclassified Mammalian orthoreovirus strain	XS22XX.p1839	49285120
JN799426.1	3857	3031	1573	52.03291	8.27491	Mammalian orthoreovirus strain 729 segment L1 lambda-3 gene, complete cds	351073	Viruses	Duplornaviricota	Resentoviricetes	Reovirales	Spinareoviridae	Orthoreovirus	Mammalian orthoreovirus	unclassified Mammalian orthoreovirus subspecies/strain	unclassified Mammalian orthoreovirus strain	XS22XX.p1839	49285120
JN799428.1	3903	3787	2473	85.66427	12.8561	Mammalian orthoreovirus strain 729 segment L3 lambda-1 gene, complete cds	351073	Viruses	Duplornaviricota	Resentoviricetes	Reovirales	Spinareoviridae	Orthoreovirus	Mammalian orthoreovirus	unclassified Mammalian orthoreovirus subspecies/strain	unclassified Mammalian orthoreovirus strain	XS22XX.p1839	49285120
JQ412763.1	1198	845	270	28.55439	4.57289	Mammalian Orthoreovirus strain T3/Bat/Germany/342/08 segment S3, complete sequence	1203543	Viruses	Duplornaviricota	Resentoviricetes	Reovirales	Spinareoviridae	Orthoreovirus	Mammalian orthoreovirus	Mammalian Orthoreovirus strain T3/Bat/Germany/342/08	Mammalian Orthoreovirus strain T3/Bat/Germany/342/08	XS22XX.p1839	49285120
JQ423900.1	750	644	266	43.771667	7.19622	Lapine rotavirus strain N5 segment 10, complete sequence	49892	Viruses	Duplornaviricota	Resentoviricetes	Reovirales	Sedoreoviridae	Rotavirus	Rotavirus A	Lapine rotavirus	Lapine rotavirus	XS22XX.p1839	49285120
JQ911594.1	7696	1712	184	3.1659157	0.485106	Norovirus Hu/GI/10360/2010/VNM, complete genome	1175308	Viruses	Pisuviricota	Pisoniviricetes	Picornavirales	Caliciviridae	Norovirus	Norwalk virus	Norovirus Hu/GI/10360/2010/VNM	Norovirus Hu/GI/10360/2010/VNM	XS22XX.p1839	49285120
JQ911763.1	8216	1732	151	2.0772378	0.372907	Canine kobuvirus CH-1, complete genome	1281440	Viruses	Pisuviricota	Pisoniviricetes	Picornavirales	Picornaviridae	Kobuvirus	Aichivirus A	Canine kobuvirus CH-1	Canine kobuvirus CH-1	XS22XX.p1839	49285120
JX195076.1	2591	2588	33643	1740.2233	263.458	Rotavirus A RVA/Human-wt/ITA/AV28/2010/G9P8 segment 3, complete sequence	1307163	Viruses	Duplornaviricota	Resentoviricetes	Reovirales	Sedoreoviridae	Rotavirus	Rotavirus A	Rotavirus A RVA/Human-wt/ITA/AV28/2010/G9P8	Rotavirus A RVA/Human-wt/ITA/AV28/2010/G9P8	XS22XX.p1839	49285120
JX195078.1	1356	1333	30580	3169.072	457.575	Rotavirus A RVA/Human-wt/ITA/AV28/2010/G9P8 segment 6, complete sequence	1307163	Viruses	Duplornaviricota	Resentoviricetes	Reovirales	Sedoreoviridae	Rotavirus	Rotavirus A	Rotavirus A RVA/Human-wt/ITA/AV28/2010/G9P8	Rotavirus A RVA/Human-wt/ITA/AV28/2010/G9P8	XS22XX.p1839	49285120
JX195080.1	1567	1564	12790	1120.2661	165.61	Rotavirus A RVA/Human-wt/ITA/AV28/2010/G9P8 segment 5, complete sequence	1307163	Viruses	Duplornaviricota	Resentoviricetes	Reovirales	Sedoreoviridae	Rotavirus	Rotavirus A	Rotavirus A RVA/Human-wt/ITA/AV28/2010/G9P8	Rotavirus A RVA/Human-wt/ITA/AV28/2010/G9P8	XS22XX.p1839	49285120
JX195081.1	1059	1059	8697	1015.61273	166.632	Rotavirus A RVA/Human-wt/ITA/AV28/2010/G9P8 segment 8, complete sequence	1307163	Viruses	Duplornaviricota	Resentoviricetes	Reovirales	Sedoreoviridae	Rotavirus	Rotavirus A	Rotavirus A RVA/Human-wt/ITA/AV28/2010/G9P8	Rotavirus A RVA/Human-wt/ITA/AV28/2010/G9P8	XS22XX.p1839	49285120
JX415467.1	3915	1092	97	2.9351926	0.502718	Porcine reovirus SHR-A segment L2, complete sequence	1220552	Viruses	Duplornaviricota	Resentoviricetes	Reovirales	Spinareoviridae	Orthoreovirus	Mammalian orthoreovirus	Porcine reovirus SHR-A	Porcine reovirus SHR-A	XS22XX.p1839	49285120
KC782514.2	1566	1564	23687	2091.9456	306.904	Rotavirus A human-wt/USA/LB1562/2010/G9P4 NSP1 (NSP1) gene, complete cds	1349389	Viruses	Duplornaviricota	Resentoviricetes	Reovirales	Sedoreoviridae	Rotavirus	Rotavirus A	Rotavirus A human-wt/USA/LB1562/2010/G9P4	Rotavirus A human-wt/USA/LB1562/2010/G9P4	XS22XX.p1839	49285120
KC782515.2	1059	1059	26978	3403.9495	516.89	Rotavirus A human-wt/USA/LB1562/2010/G9P4 NSP2 (NSP2) gene, complete cds	1349389	Viruses	Duplornaviricota	Resentoviricetes	Reovirales	Sedoreoviridae	Rotavirus	Rotavirus A	Rotavirus A human-wt/USA/LB1562/2010/G9P4	Rotavirus A human-wt/USA/LB1562/2010/G9P4	XS22XX.p1839	49285120
KC782516.2	1066	1065	22636	3050.4717	430.851	Rotavirus A human-wt/USA/LB1562/2010/G9P4 NSP3 (NSP3) gene, complete cds	1349389	Viruses	Duplornaviricota	Resentoviricetes	Reovirales	Sedoreoviridae	Rotavirus	Rotavirus A	Rotavirus A human-wt/USA/LB1562/2010/G9P4	Rotavirus A human-wt/USA/LB1562/2010/G9P4	XS22XX.p1839	49285120
KC782518.2	816	787	11211	2043.1337	278.765	Rotavirus A human-wt/USA/LB1562/2010/G9P4 NSP5 (NSP5) gene, complete cds	1349389	Viruses	Duplornaviricota	Resentoviricetes	Reovirales	Sedoreoviridae	Rotavirus	Rotavirus A	Rotavirus A human-wt/USA/LB1562/2010/G9P4	Rotavirus A human-wt/USA/LB1562/2010/G9P4	XS22XX.p1839	49285120
KC782520.2	2687	2685	88052	4353.135	664.899	Rotavirus A human-wt/USA/LB1562/2010/G9P4 VP2 (VP2) gene, complete cds	1349389	Viruses	Duplornaviricota	Resentoviricetes	Reovirales	Sedoreoviridae	Rotavirus	Rotavirus A	Rotavirus A human-wt/USA/LB1562/2010/G9P4	Rotavirus A human-wt/USA/LB1562/2010/G9P4	XS22XX.p1839	49285120
KF039910.1	6792	4765	5228	99.53854	15.6179	Human astrovirus 2 isolate Rus-Nsc05-430, complete genome	12701	Viruses	Pisuviricota	Stelpaviricetes	Stellavirales	Astroviridae	Mamastrovirus	Mamastrovirus 1	Human astrovirus 2	Human astrovirus 2	XS22XX.p1839	49285120
KF306214.1	7605	1782	718	11.317237	1.91562	Norovirus Hu/GII.4/Jingzhou/2013403/CHN, complete genome	1406149	Viruses	Pisuviricota	Pisoniviricetes	Picornavirales	Caliciviridae	Norovirus	Norwalk virus	Norovirus Hu/GII.4/Jingzhou/2013403/CHN	Norovirus Hu/GII.4/Jingzhou/2013403/CHN	XS22XX.p1839	49285120
KF499111.1	6795	2819	444	8.453273	1.3258	Feline astrovirus 2 strain 1637F, complete genome	1389204	Viruses	Pisuviricota	Stelpaviricetes	Stellavirales	Astroviridae	Mamastrovirus	Feline astrovirus 2	unclassified Feline astrovirus 2 subspecies/strain	unclassified Feline astrovirus 2 strain	XS22XX.p1839	49285120
KJ196295.1	7543	2152	353	6.299878	0.949543	Norovirus GII/Hu/JP/2010/GII.P7_GII.7/Musashimurayama/TAKAsanKimchi, complete genome	1529923	Viruses	Pisuviricota	Pisoniviricetes	Picornavirales	Caliciviridae	Norovirus	Norwalk virus	Norovirus GII/Hu/JP/2010/GII.P7_GII.7/Musashimurayama/TAKAsanKimchi	Norovirus GII/Hu/JP/2010/GII.P7_GII.7/Musashimurayama/TAKAsanKimchi	XS22XX.p1839	49285120
KP404149.1	6617	3288	593	11.486315	1.81835	Canine astrovirus strain Gillingham/2012/UK, complete genome	1157338	Viruses	Pisuviricota	Stelpaviricetes	Stellavirales	Astroviridae	Mamastrovirus	Canine astrovirus	unclassified Canine astrovirus subspecies/strain	unclassified Canine astrovirus strain	XS22XX.p1839	49285120
KT327081.1	7441	4330	1111	18.927994	3.02947	Sapovirus Hu/G1/Zhejiang1/China/2014, complete genome	1807764	Viruses	Pisuviricota	Pisoniviricetes	Picornavirales	Caliciviridae	Sapovirus	Sapporo virus	Sapovirus Hu/G1/Zhejiang1/China/2014	Sapovirus Hu/G1/Zhejiang1/China/2014	XS22XX.p1839	49285120
KX894315.1	7450	2785	391	6.509589	1.06489	Sapovirus GII.8 isolate Hu/GII.8/Miaoli/05-099-515478/2014/TW polyprotein and minor structural protein genes, complete cds	1697440	Viruses	Pisuviricota	Pisoniviricetes	Picornavirales	Caliciviridae	Sapovirus	Sapporo virus	Sapovirus GII.8	Sapovirus GII.8	XS22XX.p1839	49285120
L13745.1	6828	5896	4386	83.47889	13.0334	Human astrovirus serotype 2, complete sequence of genomic RNA	1868658	Viruses	Pisuviricota	Stelpaviricetes	Stellavirales	Astroviridae	unclassified Astroviridae genus	Human astrovirus	unclassified Human astrovirus subspecies/strain	unclassified Human astrovirus strain	XS22XX.p1839	49285120
LC209451.1	7548	1167	184	2.7158692	0.494618	Norovirus Hu/GII/JP/2011/GII.P16_GII.2/Osaka-18 RNA, nearly complete genome	1934277	Viruses	Pisuviricota	Pisoniviricetes	Picornavirales	Caliciviridae	Norovirus	Norwalk virus	Norovirus Hu/GII/JP/2011/GII.P16_GII.2/Osaka-18	Norovirus Hu/GII/JP/2011/GII.P16_GII.2/Osaka-18	XS22XX.p1839	49285120
LT900503.1	28224	11754	2081	9.683408	1.49602	Porcine torovirus isolate PToV_GER_L00926-K20_14-01_2014 genome assembly, complete genome: monopartite	237020	Viruses	Pisuviricota	Pisoniviricetes	Nidovirales	Tobaniviridae	Torovirus	Porcine torovirus	unclassified Porcine torovirus subspecies/strain	unclassified Porcine torovirus strain	XS22XX.p1839	49285120
M19296.1	5323	4876	2224	54.2225	8.4774	Canine parvovirus strain CPV-N, complete cds	10788	Viruses	Cossaviricota	Quintoviricetes	Piccovirales	Parvoviridae	Protoparvovirus	Carnivore protoparvovirus 1	Canine parvovirus	Canine parvovirus	XS22XX.p1839	49285120
M55918.1	2319	1492	428	24.943293	3.74479	Chicken anemia virus ORF1 (Cux-1), ORF2 (Cux-1), and ORF3 (Cux-1) genes, complete cds	12618	Viruses	unclassified Viruses phylum	unclassified Viruses class	unclassified Viruses order	Anelloviridae	Gyrovirus	Chicken anemia virus	unclassified Chicken anemia virus subspecies/strain	unclassified Chicken anemia virus strain	XS22XX.p1839	49285120
