accession	reference_length	covered_bases	reads_aligned	mean_coverage	RPKMF	sequence_name	taxid	kingdom	phylum	class	order	family	genus	species	subspecies	strain	sample_ID	total_filtered_reads_in_sample
JX195080.1	1567	1564	43209	3937.5786	456.608	Rotavirus A RVA/Human-wt/ITA/AV28/2010/G9P8 segment 5, complete sequence	1307163	Viruses	Duplornaviricota	Resentoviricetes	Reovirales	Sedoreoviridae	Rotavirus	Rotavirus A	Rotavirus A RVA/Human-wt/ITA/AV28/2010/G9P8	Rotavirus A RVA/Human-wt/ITA/AV28/2010/G9P8	YLB5PY.p1839	60389528
JX195081.1	1059	1059	16529	2079.242	258.457	Rotavirus A RVA/Human-wt/ITA/AV28/2010/G9P8 segment 8, complete sequence	1307163	Viruses	Duplornaviricota	Resentoviricetes	Reovirales	Sedoreoviridae	Rotavirus	Rotavirus A	Rotavirus A RVA/Human-wt/ITA/AV28/2010/G9P8	Rotavirus A RVA/Human-wt/ITA/AV28/2010/G9P8	YLB5PY.p1839	60389528
JX415467.1	3915	1781	458	14.215405	1.93719	Porcine reovirus SHR-A segment L2, complete sequence	1220552	Viruses	Duplornaviricota	Resentoviricetes	Reovirales	Spinareoviridae	Orthoreovirus	Mammalian orthoreovirus	Porcine reovirus SHR-A	Porcine reovirus SHR-A	YLB5PY.p1839	60389528
JX415470.1	1198	795	122	6.4780536	1.68633	Porcine reovirus SHR-A segment S3, complete sequence	1220552	Viruses	Duplornaviricota	Resentoviricetes	Reovirales	Spinareoviridae	Orthoreovirus	Mammalian orthoreovirus	Porcine reovirus SHR-A	Porcine reovirus SHR-A	YLB5PY.p1839	60389528
KC782514.2	1566	1563	22630	2040.8765	239.294	Rotavirus A human-wt/USA/LB1562/2010/G9P4 NSP1 (NSP1) gene, complete cds	1349389	Viruses	Duplornaviricota	Resentoviricetes	Reovirales	Sedoreoviridae	Rotavirus	Rotavirus A	Rotavirus A human-wt/USA/LB1562/2010/G9P4	Rotavirus A human-wt/USA/LB1562/2010/G9P4	YLB5PY.p1839	60389528
KC782515.2	1059	1059	23993	3207.9363	375.169	Rotavirus A human-wt/USA/LB1562/2010/G9P4 NSP2 (NSP2) gene, complete cds	1349389	Viruses	Duplornaviricota	Resentoviricetes	Reovirales	Sedoreoviridae	Rotavirus	Rotavirus A	Rotavirus A human-wt/USA/LB1562/2010/G9P4	Rotavirus A human-wt/USA/LB1562/2010/G9P4	YLB5PY.p1839	60389528
KC782516.2	1066	1065	20101	2859.1682	312.247	Rotavirus A human-wt/USA/LB1562/2010/G9P4 NSP3 (NSP3) gene, complete cds	1349389	Viruses	Duplornaviricota	Resentoviricetes	Reovirales	Sedoreoviridae	Rotavirus	Rotavirus A	Rotavirus A human-wt/USA/LB1562/2010/G9P4	Rotavirus A human-wt/USA/LB1562/2010/G9P4	YLB5PY.p1839	60389528
KC782518.2	816	794	9415	1700.464	191.059	Rotavirus A human-wt/USA/LB1562/2010/G9P4 NSP5 (NSP5) gene, complete cds	1349389	Viruses	Duplornaviricota	Resentoviricetes	Reovirales	Sedoreoviridae	Rotavirus	Rotavirus A	Rotavirus A human-wt/USA/LB1562/2010/G9P4	Rotavirus A human-wt/USA/LB1562/2010/G9P4	YLB5PY.p1839	60389528
KC782520.2	2687	2685	79762	3999.9412	491.549	Rotavirus A human-wt/USA/LB1562/2010/G9P4 VP2 (VP2) gene, complete cds	1349389	Viruses	Duplornaviricota	Resentoviricetes	Reovirales	Sedoreoviridae	Rotavirus	Rotavirus A	Rotavirus A human-wt/USA/LB1562/2010/G9P4	Rotavirus A human-wt/USA/LB1562/2010/G9P4	YLB5PY.p1839	60389528
KF039910.1	6792	3169	1189	23.663506	2.89883	Human astrovirus 2 isolate Rus-Nsc05-430, complete genome	12701	Viruses	Pisuviricota	Stelpaviricetes	Stellavirales	Astroviridae	Mamastrovirus	Mamastrovirus 1	Human astrovirus 2	Human astrovirus 2	YLB5PY.p1839	60389528
KF374704.1	6780	1777	86	1.5920061	0.210042	Feline astrovirus Viseu, complete genome	1413815	Viruses	Pisuviricota	Stelpaviricetes	Stellavirales	Astroviridae	Mamastrovirus	Feline astrovirus 2	Feline astrovirus Viseu	Feline astrovirus Viseu	YLB5PY.p1839	60389528
KF792837.1	5479	2130	128	2.9958715	0.386854	Feline bocavirus 2 isolate POR1, complete genome	1417756	Viruses	Cossaviricota	Quintoviricetes	Piccovirales	Parvoviridae	Bocaparvovirus	Carnivore bocaparvovirus 4	Feline bocaparvovirus 2	Feline bocaparvovirus 2	YLB5PY.p1839	60389528
KJ196295.1	7543	2379	145	2.6392534	0.318319	Norovirus GII/Hu/JP/2010/GII.P7_GII.7/Musashimurayama/TAKAsanKimchi, complete genome	1529923	Viruses	Pisuviricota	Pisoniviricetes	Picornavirales	Caliciviridae	Norovirus	Norwalk virus	Norovirus GII/Hu/JP/2010/GII.P7_GII.7/Musashimurayama/TAKAsanKimchi	Norovirus GII/Hu/JP/2010/GII.P7_GII.7/Musashimurayama/TAKAsanKimchi	YLB5PY.p1839	60389528
KJ541167.1	7371	1160	237	4.1563497	0.532427	Coxsackievirus A6 isolate 1232/SH/CHN/2010, complete genome	86107	Viruses	Pisuviricota	Pisoniviricetes	Picornavirales	Picornaviridae	Enterovirus	Enterovirus A	Coxsackievirus A6	Coxsackievirus A6	YLB5PY.p1839	60389528
KM023140.1	7998	3273	366	6.1242356	0.757771	Salivirus FHB, complete genome	1547495	Viruses	Pisuviricota	Pisoniviricetes	Picornavirales	Picornaviridae	Salivirus	Salivirus FHB	unclassified Salivirus FHB subspecies/strain	unclassified Salivirus FHB strain	YLB5PY.p1839	60389528
KM369887.2	1485	879	118	12.198502	1.31581	Rotavirus I strain KE135/2012 NSP1-1 and NSP1-2 genes, complete cds	1637496	Viruses	Duplornaviricota	Resentoviricetes	Reovirales	Sedoreoviridae	Rotavirus	Rotavirus I	unclassified Rotavirus I subspecies/strain	unclassified Rotavirus I strain	YLB5PY.p1839	60389528
KP404149.1	6617	3711	862	17.447039	2.15717	Canine astrovirus strain Gillingham/2012/UK, complete genome	1157338	Viruses	Pisuviricota	Stelpaviricetes	Stellavirales	Astroviridae	Mamastrovirus	Canine astrovirus	unclassified Canine astrovirus subspecies/strain	unclassified Canine astrovirus strain	YLB5PY.p1839	60389528
KT327081.1	7441	3020	493	8.905911	1.09712	Sapovirus Hu/G1/Zhejiang1/China/2014, complete genome	1807764	Viruses	Pisuviricota	Pisoniviricetes	Picornavirales	Caliciviridae	Sapovirus	Sapporo virus	Sapovirus Hu/G1/Zhejiang1/China/2014	Sapovirus Hu/G1/Zhejiang1/China/2014	YLB5PY.p1839	60389528
KU727766.1	5166	1728	197	5.119019	0.631466	Parus major densovirus isolate PmDNV-JL, complete genome	1907771	Viruses	Cossaviricota	Quintoviricetes	Piccovirales	Parvoviridae	unclassified Parvoviridae genus	Parus major densovirus	unclassified Parus major densovirus subspecies/strain	unclassified Parus major densovirus strain	YLB5PY.p1839	60389528
KU870455.1	7563	1853	221	3.9545393	0.483879	Norovirus GII.6 isolate NHBGR59, complete genome	499193	Viruses	Pisuviricota	Pisoniviricetes	Picornavirales	Caliciviridae	Norovirus	Norwalk virus	Norovirus GII.6	Norovirus GII.6	YLB5PY.p1839	60389528
KX431437.1	7563	1444	88	1.4064481	0.192676	Sapporo virus isolate Hu/GV/0003/Sollentuna/2016/SWE, complete genome	95342	Viruses	Pisuviricota	Pisoniviricetes	Picornavirales	Caliciviridae	Sapovirus	Sapporo virus	unclassified Sapporo virus subspecies/strain	unclassified Sapporo virus strain	YLB5PY.p1839	60389528
KX894315.1	7450	1852	188	3.341507	0.417869	Sapovirus GII.8 isolate Hu/GII.8/Miaoli/05-099-515478/2014/TW polyprotein and minor structural protein genes, complete cds	1697440	Viruses	Pisuviricota	Pisoniviricetes	Picornavirales	Caliciviridae	Sapovirus	Sapporo virus	Sapovirus GII.8	Sapovirus GII.8	YLB5PY.p1839	60389528
KY040274.1	192183	1392	122	0.08445944	0.0105119	Molluscum contagiosum virus subtype 2 isolate Madrid 2016_1, complete genome	10281	Viruses	Nucleocytoviricota	Pokkesviricetes	Chitovirales	Poxviridae	Molluscipoxvirus	Molluscum contagiosum virus	Molluscum contagiosum virus subtype 2	Molluscum contagiosum virus subtype 2	YLB5PY.p1839	60389528
KY040275.1	188253	2959	299	0.21476531	0.0263007	Molluscum contagiosum virus subtype 1 isolate Madrid 2016_3, complete genome	10280	Viruses	Nucleocytoviricota	Pokkesviricetes	Chitovirales	Poxviridae	Molluscipoxvirus	Molluscum contagiosum virus	Molluscum contagiosum virus subtype 1	Molluscum contagiosum virus subtype 1	YLB5PY.p1839	60389528
KY242583.1	7399	1186	147	2.743413	0.32899	Human papillomavirus type 209 isolate FA108, complete genome	1961924	Viruses	Cossaviricota	Papovaviricetes	Zurhausenvirales	Papillomaviridae	Betapapillomavirus	Betapapillomavirus 2	Human papillomavirus type 209	Human papillomavirus type 209	YLB5PY.p1839	60389528
KY399057.1	1689	1006	50	3.59974	0.490206	Picobirnavirus dog/KNA/2015 strain PBV/Dog/KNA/RVC7/2015 RNA-dependent RNA polymerase gene, complete cds	1961162	Viruses	Pisuviricota	Duplopiviricetes	Durnavirales	Picobirnaviridae	Picobirnavirus	Picobirnavirus dog/KNA/2015	unclassified Picobirnavirus dog/KNA/2015 subspecies/strain	unclassified Picobirnavirus dog/KNA/2015 strain	YLB5PY.p1839	60389528
L13745.1	6828	5346	2500	50.274185	6.06296	Human astrovirus serotype 2, complete sequence of genomic RNA	1868658	Viruses	Pisuviricota	Stelpaviricetes	Stellavirales	Astroviridae	unclassified Astroviridae genus	Human astrovirus	unclassified Human astrovirus subspecies/strain	unclassified Human astrovirus strain	YLB5PY.p1839	60389528
LC088094.1	28359	1506	115	0.5564536	0.0671499	Bovine torovirus genomic RNA, complete genome, strain: BToV Ishikawa/2010	74501	Viruses	Pisuviricota	Pisoniviricetes	Nidovirales	Tobaniviridae	Torovirus	Bovine torovirus	unclassified Bovine torovirus subspecies/strain	unclassified Bovine torovirus strain	YLB5PY.p1839	60389528
LN854568.1	7550	1169	80	1.5567567	0.175461	Norovirus GII/Hu/NL/2014/GII.6/Groningen, complete genome	1665649	Viruses	Pisuviricota	Pisoniviricetes	Picornavirales	Caliciviridae	Norovirus	Norwalk virus	Norovirus GII/Hu/NL/2014/GII.6/Groningen	Norovirus GII/Hu/NL/2014/GII.6/Groningen	YLB5PY.p1839	60389528
LT900503.1	28224	3222	181	0.83988744	0.106194	Porcine torovirus isolate PToV_GER_L00926-K20_14-01_2014 genome assembly, complete genome: monopartite	237020	Viruses	Pisuviricota	Pisoniviricetes	Nidovirales	Tobaniviridae	Torovirus	Porcine torovirus	unclassified Porcine torovirus subspecies/strain	unclassified Porcine torovirus strain	YLB5PY.p1839	60389528
M12737.1	7654	1373	62	1.0435767	0.134135	Human papillomavirus type 8, complete genome	10579	Viruses	Cossaviricota	Papovaviricetes	Zurhausenvirales	Papillomaviridae	Betapapillomavirus	Betapapillomavirus 1	Human papillomavirus type 8	Human papillomavirus type 8	YLB5PY.p1839	60389528
M17463.1	7746	2055	231	3.8697999	0.493825	Human papillomoavirus type 5, complete genome	333923	Viruses	Cossaviricota	Papovaviricetes	Zurhausenvirales	Papillomaviridae	Betapapillomavirus	Betapapillomavirus 1	Human papillomavirus 5	Human papillomavirus 5	YLB5PY.p1839	60389528
M19296.1	5323	5258	7799	189.73729	24.2617	Canine parvovirus strain CPV-N, complete cds	10788	Viruses	Cossaviricota	Quintoviricetes	Piccovirales	Parvoviridae	Protoparvovirus	Carnivore protoparvovirus 1	Canine parvovirus	Canine parvovirus	YLB5PY.p1839	60389528
M55918.1	2319	1745	561	34.489628	4.0059	Chicken anemia virus ORF1 (Cux-1), ORF2 (Cux-1), and ORF3 (Cux-1) genes, complete cds	12618	Viruses	unclassified Viruses phylum	unclassified Viruses class	unclassified Viruses order	Anelloviridae	Gyrovirus	Chicken anemia virus	unclassified Chicken anemia virus subspecies/strain	unclassified Chicken anemia virus strain	YLB5PY.p1839	60389528
MF118167.1	3925	3594	2081	68.9351	8.77952	Human fecal virus Jorvi2, complete genome	2017081	Viruses	Cressdnaviricota	Arfiviricetes	Cirlivirales	Circoviridae	unclassified Circoviridae genus	Human fecal virus Jorvi2	unclassified Human fecal virus Jorvi2 subspecies/strain	unclassified Human fecal virus Jorvi2 strain	YLB5PY.p1839	60389528
MF684776.1	6803	6049	1579	30.344807	3.84344	Human astrovirus 5 isolate 2013/Fuzhou/85, complete genome	35741	Viruses	Pisuviricota	Stelpaviricetes	Stellavirales	Astroviridae	Mamastrovirus	Mamastrovirus 1	Human astrovirus 5	Human astrovirus 5	YLB5PY.p1839	60389528
MF947441.1	8244	8048	7473	121.32963	15.0105	Kobuvirus sp. strain 16317x87 polyprotein gene, complete cds	2094719	Viruses	Pisuviricota	Pisoniviricetes	Picornavirales	Picornaviridae	Kobuvirus	Kobuvirus sp.	unclassified Kobuvirus sp. subspecies/strain	unclassified Kobuvirus sp. strain	YLB5PY.p1839	60389528
MH188020.1	5415	2986	4257	106.696106	13.018	Culex Bastrovirus-like virus strain CAVL/Fresno, complete genome	2304505	Viruses	Pisuviricota	Stelpaviricetes	Stellavirales	Astroviridae	unclassified Astroviridae genus	Culex Bastrovirus-like virus	unclassified Culex Bastrovirus-like virus subspecies/strain	unclassified Culex Bastrovirus-like virus strain	YLB5PY.p1839	60389528
MH747478.1	8312	1799	162	2.3727028	0.322736	Canine kobuvirus strain CaKoV-26, complete genome	1836608	Viruses	Pisuviricota	Pisoniviricetes	Picornavirales	Picornaviridae	Kobuvirus	Canine kobuvirus	unclassified Canine kobuvirus subspecies/strain	unclassified Canine kobuvirus strain	YLB5PY.p1839	60389528
NC_001716.2	153080	1019	140	0.11927679	0.0151443	Human herpesvirus 7, complete genome	10372	Viruses	Peploviricota	Herviviricetes	Herpesvirales	Herpesviridae	Roseolovirus	Human betaherpesvirus 7	unclassified Human betaherpesvirus 7 subspecies/strain	unclassified Human betaherpesvirus 7 strain	YLB5PY.p1839	60389528
NC_009334.1	172764	4395	590	0.44395587	0.0565506	Human herpesvirus 4, complete genome	12509	Viruses	Peploviricota	Herviviricetes	Herpesvirales	Herpesviridae	Lymphocryptovirus	Human gammaherpesvirus 4	Human herpesvirus 4 type 2	Human herpesvirus 4 type 2	YLB5PY.p1839	60389528
U31782.1	7452	1212	70	1.3159409	0.155548	Human papillomavirus type 24, complete genome	37956	Viruses	Cossaviricota	Papovaviricetes	Zurhausenvirales	Papillomaviridae	Betapapillomavirus	Betapapillomavirus 1	human papillomavirus 24	human papillomavirus 24	YLB5PY.p1839	60389528
U50869.1	7514	7112	8748	153.11108	19.2786	Tobacco Ringspot virus RNA1 polyprotein gene, complete cds	12282	Viruses	Pisuviricota	Pisoniviricetes	Picornavirales	Secoviridae	Nepovirus	Tobacco ringspot virus	unclassified Tobacco ringspot virus subspecies/strain	unclassified Tobacco ringspot virus strain	YLB5PY.p1839	60389528
V01108.1	5153	5041	13016	334.63422	41.8269	Human BK virus (strain Dunlop) genome. (Closely related to SV40.)	1891762	Viruses	Cossaviricota	Papovaviricetes	Sepolyvirales	Polyomaviridae	Betapolyomavirus	Betapolyomavirus hominis	unclassified Betapolyomavirus hominis subspecies/strain	unclassified Betapolyomavirus hominis strain	YLB5PY.p1839	60389528
X61586.1	1196	768	340	31.927341	4.70745	Reovirus type 1 S4 RNA encoding sigma 3	10884	Viruses	Duplornaviricota	Resentoviricetes	Reovirales	Spinareoviridae	Orthoreovirus	Mammalian orthoreovirus	Mammalian orthoreovirus 1 Lang	Mammalian orthoreovirus 1 Lang	YLB5PY.p1839	60389528
X70827.1	7353	2972	283	5.191309	0.637324	Human papillomavirus type 4 complete genome	10617	Viruses	Cossaviricota	Papovaviricetes	Zurhausenvirales	Papillomaviridae	Gammapapillomavirus	Gammapapillomavirus 1	Human papillomavirus 4	Human papillomavirus 4	YLB5PY.p1839	60389528
X74466.1	7673	1322	132	2.2303603	0.28487	Human papillomavirus type 12 genomic DNA	10604	Viruses	Cossaviricota	Papovaviricetes	Zurhausenvirales	Papillomaviridae	Betapapillomavirus	Betapapillomavirus 1	human papillomavirus 12	human papillomavirus 12	YLB5PY.p1839	60389528
X74468.1	7412	1325	108	1.9135225	0.241283	Human papillomavirus type 15 genomic DNA	10606	Viruses	Cossaviricota	Papovaviricetes	Zurhausenvirales	Papillomaviridae	Betapapillomavirus	Betapapillomavirus 2	Human papillomavirus 15	Human papillomavirus 15	YLB5PY.p1839	60389528
X74470.1	7685	1010	75	1.2800266	0.161605	Human papillomavirus type 19 genomic DNA	10608	Viruses	Cossaviricota	Papovaviricetes	Zurhausenvirales	Papillomaviridae	Betapapillomavirus	Betapapillomavirus 1	Human papillomavirus 19	Human papillomavirus 19	YLB5PY.p1839	60389528
X74480.1	7560	1290	146	2.597301	0.319793	Human papillomavirus type 49 genomic DNA	10616	Viruses	Cossaviricota	Papovaviricetes	Zurhausenvirales	Papillomaviridae	Betapapillomavirus	Betapapillomavirus 3	Human papillomavirus type 49	Human papillomavirus type 49	YLB5PY.p1839	60389528
Y15176.1	7427	1265	86	1.7170538	0.191745	Human papillomavirus type 80 E6, E7, E1, E2, E4, L2, and L1 genes	69987	Viruses	Cossaviricota	Papovaviricetes	Zurhausenvirales	Papillomaviridae	Betapapillomavirus	Betapapillomavirus 2	Human papillomavirus 80	Human papillomavirus 80	YLB5PY.p1839	60389528
Z25771.1	6813	5893	2848	56.474712	6.92213	Human astrovirus type 1 genes for capsid protein and nonstructural protein	12456	Viruses	Pisuviricota	Stelpaviricetes	Stellavirales	Astroviridae	Mamastrovirus	Mamastrovirus 1	Human astrovirus 1	Human astrovirus 1	YLB5PY.p1839	60389528
AY363727.1	3929	3322	12533	420.79996	52.8216	Tobacco ringspot virus RNA2 segment, complete sequence	12282	Viruses	Pisuviricota	Pisoniviricetes	Picornavirales	Secoviridae	Nepovirus	Tobacco ringspot virus	unclassified Tobacco ringspot virus subspecies/strain	unclassified Tobacco ringspot virus strain	YLB5PY.p1839	60389528
GQ468268.1	2251	1178	247	12.788197	1.81702	Mammalian orthoreovirus 3 isolate MPC/04 mu-2 protein (M1) gene, complete cds	538123	Viruses	Duplornaviricota	Resentoviricetes	Reovirales	Spinareoviridae	Orthoreovirus	Mammalian orthoreovirus	Mammalian orthoreovirus 3	Mammalian orthoreovirus 3	YLB5PY.p1839	60389528
GQ468269.1	2127	2127	6043	394.7046	47.0461	Mammalian orthoreovirus 3 isolate MPC/04 mu-1 protein (M2) gene, complete cds	538123	Viruses	Duplornaviricota	Resentoviricetes	Reovirales	Spinareoviridae	Orthoreovirus	Mammalian orthoreovirus	Mammalian orthoreovirus 3	Mammalian orthoreovirus 3	YLB5PY.p1839	60389528
GQ468271.1	2241	1815	651	38.541367	4.81036	Mammalian orthoreovirus 3 isolate MPC/04 mu-NS protein (M3) gene, complete cds	538123	Viruses	Duplornaviricota	Resentoviricetes	Reovirales	Spinareoviridae	Orthoreovirus	Mammalian orthoreovirus	Mammalian orthoreovirus 3	Mammalian orthoreovirus 3	YLB5PY.p1839	60389528
GQ468272.1	1368	1259	489	52.045155	5.91917	Mammalian orthoreovirus 3 isolate MPC/04 sigma-1 protein (S1) gene, complete cds	538123	Viruses	Duplornaviricota	Resentoviricetes	Reovirales	Spinareoviridae	Orthoreovirus	Mammalian orthoreovirus	Mammalian orthoreovirus 3	Mammalian orthoreovirus 3	YLB5PY.p1839	60389528
GQ468275.1	1098	944	240	30.11076	3.61949	Mammalian orthoreovirus 3 isolate MPC/04 sigma-3 protein (S4) gene, complete cds	538123	Viruses	Duplornaviricota	Resentoviricetes	Reovirales	Spinareoviridae	Orthoreovirus	Mammalian orthoreovirus	Mammalian orthoreovirus 3	Mammalian orthoreovirus 3	YLB5PY.p1839	60389528
JX204739.1	3914	3170	1575	53.514347	6.66343	Mammalian orthoreovirus 2 strain TRALAU2004 lambda2 gene, complete cds	538121	Viruses	Duplornaviricota	Resentoviricetes	Reovirales	Spinareoviridae	Orthoreovirus	Mammalian orthoreovirus	Mammalian orthoreovirus 2	Mammalian orthoreovirus 2	YLB5PY.p1839	60389528
JX204742.1	2203	1324	280	15.445689	2.10466	Mammalian orthoreovirus 2 strain TRALAU2004 mu1 gene, complete cds	538121	Viruses	Duplornaviricota	Resentoviricetes	Reovirales	Spinareoviridae	Orthoreovirus	Mammalian orthoreovirus	Mammalian orthoreovirus 2	Mammalian orthoreovirus 2	YLB5PY.p1839	60389528
KX263307.1	3804	2055	609	20.95676	2.65103	Mammalian orthoreovirus 1 isolate B/03 lambda-3 protein (L1) gene, complete cds	538120	Viruses	Duplornaviricota	Resentoviricetes	Reovirales	Spinareoviridae	Orthoreovirus	Mammalian orthoreovirus	Mammalian orthoreovirus 1	Mammalian orthoreovirus 1	YLB5PY.p1839	60389528
KF861773.1	1730	1106	1561	129.0595	14.9415	Porcine picobirnavirus strain 221/04-16/ITA/2004 segment S, complete sequence	442302	Viruses	Pisuviricota	Duplopiviricetes	Durnavirales	Picobirnaviridae	Picobirnavirus	Porcine picobirnavirus	unclassified Porcine picobirnavirus subspecies/strain	unclassified Porcine picobirnavirus strain	YLB5PY.p1839	60389528
KC769372.1	2686	2117	54305	2876.7007	334.79	UNVERIFIED: Rotavirus A strain RVA/Human-wt/AUS/CK00065/2007/G1P[8] segment 2 genomic sequence	28875	Viruses	Duplornaviricota	Resentoviricetes	Reovirales	Sedoreoviridae	Rotavirus	Rotavirus A	unclassified Rotavirus A subspecies/strain	unclassified Rotavirus A strain	YLB5PY.p1839	60389528
KC769373.1	2530	1610	1004	53.60084	6.5713	UNVERIFIED: Rotavirus A strain RVA/Human-wt/AUS/CK00065/2007/G1P[8] segment 3 genomic sequence	28875	Viruses	Duplornaviricota	Resentoviricetes	Reovirales	Sedoreoviridae	Rotavirus	Rotavirus A	unclassified Rotavirus A subspecies/strain	unclassified Rotavirus A strain	YLB5PY.p1839	60389528
KC769368.1	1015	703	2445	468.5942	39.8888	UNVERIFIED: Rotavirus A strain RVA/Human-wt/AUS/CK00065/2007/G1P[8] segment 7 genomic sequence	28875	Viruses	Duplornaviricota	Resentoviricetes	Reovirales	Sedoreoviridae	Rotavirus	Rotavirus A	unclassified Rotavirus A subspecies/strain	unclassified Rotavirus A strain	YLB5PY.p1839	60389528
EF583031.1	2508	1482	455	24.350296	3.00415	Rotavirus A strain RVA/Human-tc/BRA/IAL28/1992/G5P[8] capping protein VP3 gene, complete cds	28875	Viruses	Duplornaviricota	Resentoviricetes	Reovirales	Sedoreoviridae	Rotavirus	Rotavirus A	unclassified Rotavirus A subspecies/strain	unclassified Rotavirus A strain	YLB5PY.p1839	60389528
KX778615.1	2328	1582	19146	1124.9835	136.186	Rotavirus A isolate Hu/DOM/2013840364/2013/G4P[6-8_R] VP4 (VP4) gene, complete cds	28875	Viruses	Duplornaviricota	Resentoviricetes	Reovirales	Sedoreoviridae	Rotavirus	Rotavirus A	unclassified Rotavirus A subspecies/strain	unclassified Rotavirus A strain	YLB5PY.p1839	60389528
KX778616.1	1461	1013	5251	462.2624	59.5155	Rotavirus A isolate Hu/DOM/2013840364/2013/G4P[6-8_R] NSP1 (NSP1) gene, complete cds	28875	Viruses	Duplornaviricota	Resentoviricetes	Reovirales	Sedoreoviridae	Rotavirus	Rotavirus A	unclassified Rotavirus A subspecies/strain	unclassified Rotavirus A strain	YLB5PY.p1839	60389528
KU048654.1	1062	1061	3675	496.69955	57.3022	Rotavirus A isolate Hu-wt/ITA/RG179/13/2013/G12P8 VP7 gene, complete cds	28875	Viruses	Duplornaviricota	Resentoviricetes	Reovirales	Sedoreoviridae	Rotavirus	Rotavirus A	unclassified Rotavirus A subspecies/strain	unclassified Rotavirus A strain	YLB5PY.p1839	60389528
KY055429.1	2585	2553	68203	3530.5732	436.899	Rotavirus A strain RVA/Goat-wt/UGA/BUW-14-085/2014/G6P[1] VP3 (VP3) mRNA, complete cds	28875	Viruses	Duplornaviricota	Resentoviricetes	Reovirales	Sedoreoviridae	Rotavirus	Rotavirus A	unclassified Rotavirus A subspecies/strain	unclassified Rotavirus A strain	YLB5PY.p1839	60389528
FJ206135.1	723	612	2429	604.38043	55.6324	Bovine rotavirus strain KJ69-1 NSP4 gene, complete cds	10927	Viruses	Duplornaviricota	Resentoviricetes	Reovirales	Sedoreoviridae	Rotavirus	Rotavirus A	Bovine rotavirus	Bovine rotavirus	YLB5PY.p1839	60389528
GU827407.1	2693	1926	827	42.674793	5.08519	Rotavirus A strain RVA/Cat-wt/ITA/BA222/2005/G3P[9] VP2 gene, complete cds	28875	Viruses	Duplornaviricota	Resentoviricetes	Reovirales	Sedoreoviridae	Rotavirus	Rotavirus A	unclassified Rotavirus A subspecies/strain	unclassified Rotavirus A strain	YLB5PY.p1839	60389528
KU048554.1	2735	2725	51340	2557.3865	310.84	Rotavirus A isolate Hu-wt/ITA/PA525/14/2014/G12P8 VP2 gene, complete cds	28875	Viruses	Duplornaviricota	Resentoviricetes	Reovirales	Sedoreoviridae	Rotavirus	Rotavirus A	unclassified Rotavirus A subspecies/strain	unclassified Rotavirus A strain	YLB5PY.p1839	60389528
KU708259.1	3302	1975	417	17.501587	2.09121	Rotavirus A strain RVA/roe deer-wt/SLO/D38-14/2014/G6P[15] VP1 gene, complete cds	28875	Viruses	Duplornaviricota	Resentoviricetes	Reovirales	Sedoreoviridae	Rotavirus	Rotavirus A	unclassified Rotavirus A subspecies/strain	unclassified Rotavirus A strain	YLB5PY.p1839	60389528
KX988284.1	750	743	1823	337.24832	40.2498	Rotavirus A strain RVA/Pig-wt/UGA/KYE-14-A048/2014/G3P[13] nonstructural protein 4 (NSP4) mRNA, partial cds	28875	Viruses	Duplornaviricota	Resentoviricetes	Reovirales	Sedoreoviridae	Rotavirus	Rotavirus A	unclassified Rotavirus A subspecies/strain	unclassified Rotavirus A strain	YLB5PY.p1839	60389528
DQ146672.1	2753	2411	9986	460.06955	60.0653	Rotavirus A strain RVA/Human/BGD/Matlab13/2003/G12P[6] VP2 gene, complete cds	28875	Viruses	Duplornaviricota	Resentoviricetes	Reovirales	Sedoreoviridae	Rotavirus	Rotavirus A	unclassified Rotavirus A subspecies/strain	unclassified Rotavirus A strain	YLB5PY.p1839	60389528
DQ146673.1	2591	1539	989	26.539534	6.32073	Rotavirus A strain RVA/Human/BGD/Matlab13/2003/G12P[6] VP3 gene, complete cds	28875	Viruses	Duplornaviricota	Resentoviricetes	Reovirales	Sedoreoviridae	Rotavirus	Rotavirus A	unclassified Rotavirus A subspecies/strain	unclassified Rotavirus A strain	YLB5PY.p1839	60389528
KF371682.1	1062	1044	31902	4383.2314	497.43	Human rotavirus A strain RVA/Human-tc/CHN/L148/2004/G3P[8] segment 9, complete sequence	10941	Viruses	Duplornaviricota	Resentoviricetes	Reovirales	Sedoreoviridae	Rotavirus	Rotavirus A	Human rotavirus A	Human rotavirus A	YLB5PY.p1839	60389528
KT695085.1	2359	2168	13025	704.06384	91.4299	Human rotavirus A strain RVA/Human-tc/USA/DC3695-40-AG/1989/G1P[8] VP4 (VP4) gene, complete cds	10941	Viruses	Duplornaviricota	Resentoviricetes	Reovirales	Sedoreoviridae	Rotavirus	Rotavirus A	Human rotavirus A	Human rotavirus A	YLB5PY.p1839	60389528
KC580008.1	2333	1748	1629	65.690796	11.5623	Rotavirus A strain RVA/Human-wt/USA/DC102/1974/G1P[8] segment 4 outer capsid spike protein VP4 (VP4) gene, complete cds	28875	Viruses	Duplornaviricota	Resentoviricetes	Reovirales	Sedoreoviridae	Rotavirus	Rotavirus A	unclassified Rotavirus A subspecies/strain	unclassified Rotavirus A strain	YLB5PY.p1839	60389528
KU356605.1	751	659	16038	2994.6406	353.63	Human rotavirus A strain RVA/Human-wt/BGN/M315/2013/G2P[4] NSP4 gene, complete cds	10941	Viruses	Duplornaviricota	Resentoviricetes	Reovirales	Sedoreoviridae	Rotavirus	Rotavirus A	Human rotavirus A	Human rotavirus A	YLB5PY.p1839	60389528
KM369892.2	3518	1918	143	5.808789	0.673098	Rotavirus I strain KE135/2012 VP1 gene, complete cds	1637496	Viruses	Duplornaviricota	Resentoviricetes	Reovirales	Sedoreoviridae	Rotavirus	Rotavirus I	unclassified Rotavirus I subspecies/strain	unclassified Rotavirus I strain	YLB5PY.p1839	60389528
KM369895.2	2371	1184	117	6.322377	0.817133	Rotavirus I strain KE135/2012 VP4 gene, complete cds	1637496	Viruses	Duplornaviricota	Resentoviricetes	Reovirales	Sedoreoviridae	Rotavirus	Rotavirus I	unclassified Rotavirus I subspecies/strain	unclassified Rotavirus I strain	YLB5PY.p1839	60389528
